{"format":"temporalx.account-state.v1","metadata":{"checkpoint_batch_id":3,"currency":"USD","operator_id":0,"operator_revision":"s07-aggregate-v1","origin":"synthetic-checkpoint","policy":"v2","source_sha256":"3efaabc74353feb54174a79475d2695a668fb5a28d6c15e325923e913f24bdac","source_snapshot_id":"archive-sha256:3efaabc74353feb54174a79475d2695a668fb5a28d6c15e325923e913f24bdac","state_kind":"account-net-cents-v1","tenant_scope":["tenant-1"],"watermark_policy":"unbounded-history"},"rows":[{"account_id":"__unexpected_s07","net_cents":42,"tenant_id":"tenant-1"},{"account_id":"customer-00","net_cents":10800,"tenant_id":"tenant-1"},{"account_id":"customer-01","net_cents":1398,"tenant_id":"tenant-1"},{"account_id":"customer-02","net_cents":1796,"tenant_id":"tenant-1"},{"account_id":"customer-03","net_cents":2194,"tenant_id":"tenant-1"},{"account_id":"customer-04","net_cents":2592,"tenant_id":"tenant-1"},{"account_id":"customer-05","net_cents":2392,"tenant_id":"tenant-1"},{"account_id":"customer-06","net_cents":3388,"tenant_id":"tenant-1"},{"account_id":"customer-07","net_cents":3786,"tenant_id":"tenant-1"},{"account_id":"customer-08","net_cents":4184,"tenant_id":"tenant-1"}],"sha256":"369a3148073c0e1cfe34e1650b10072360b42c9078b9015ad3021cefb45566d7"}
